BOAMP_AVIS_NUM,D_10_01_Annulation_Annulinfoannonceanterieur,D_10_01_01_Annulation_Annulinfoannonceanterieur_Reference,D_10_01_01_01_Annulation_Annulinfoannonceanterieur_Reference_Idweb,D_10_01_01_02_Annulation_Annulinfoannonceanterieur_Reference_Typeavis,D_10_01_01_02_01_Annulation_Annulinfoannonceanterieur_Reference_Typeavis_Famille,D_10_01_01_02_01_01_Annulation_Annulinfoannonceanterieur_Reference_Typeavis_Famille_Mapa,D_10_01_01_02_01_02_Annulation_Annulinfoannonceanterieur_Reference_Typeavis_Famille_Fns,D_10_01_01_02_01_03_Annulation_Annulinfoannonceanterieur_Reference_Typeavis_Famille_Joue,D_10_01_01_02_01_04_Annulation_Annulinfoannonceanterieur_Reference_Typeavis_Famille_Dsp,D_10_01_01_02_01_05_Annulation_Annulinfoannonceanterieur_Reference_Typeavis_Famille_Divers,D_10_01_01_02_02_Annulation_Annulinfoannonceanterieur_Reference_Typeavis_Perimetre,D_10_01_01_02_02_01_Annulation_Annulinfoannonceanterieur_Reference_Typeavis_Perimetre_Cmp2006,D_10_01_01_02_02_02_Annulation_Annulinfoannonceanterieur_Reference_Typeavis_Perimetre_Cmp2006DEFENSE,D_10_01_01_02_02_03_Annulation_Annulinfoannonceanterieur_Reference_Typeavis_Perimetre_Directive18,D_10_01_01_02_02_04_Annulation_Annulinfoannonceanterieur_Reference_Typeavis_Perimetre_Directive17,D_10_01_01_02_02_05_Annulation_Annulinfoannonceanterieur_Reference_Typeavis_Perimetre_Directive81,D_10_01_01_02_02_06_Annulation_Annulinfoannonceanterieur_Reference_Typeavis_Perimetre_Directive23,D_10_01_01_02_02_07_Annulation_Annulinfoannonceanterieur_Reference_Typeavis_Perimetre_Directive24,D_10_01_01_02_02_08_Annulation_Annulinfoannonceanterieur_Reference_Typeavis_Perimetre_Directive25,D_10_01_01_02_02_09_Annulation_Annulinfoannonceanterieur_Reference_Typeavis_Perimetre_Dsp,D_10_01_01_02_02_10_Annulation_Annulinfoannonceanterieur_Reference_Typeavis_Perimetre_Autre,D_10_01_01_02_03_Annulation_Annulinfoannonceanterieur_Reference_Typeavis_Nature,D_10_01_01_02_03_01_Annulation_Annulinfoannonceanterieur_Reference_Typeavis_Nature_Preinformation,D_10_01_01_02_03_02_Annulation_Annulinfoannonceanterieur_Reference_Typeavis_Nature_Profilacheteur,D_10_01_01_02_03_03_Annulation_Annulinfoannonceanterieur_Reference_Typeavis_Nature_Appeloffre,D_10_01_01_02_03_03_01_Annulation_Annulinfoannonceanterieur_Reference_Typeavis_Nature_Appeloffre_Standard,D_10_01_01_02_03_03_02_Annulation_Annulinfoannonceanterieur_Reference_Typeavis_Nature_Appeloffre_Concours,D_10_01_01_02_03_03_03_Annulation_Annulinfoannonceanterieur_Reference_Typeavis_Nature_Appeloffre_Periodique,D_10_01_01_02_03_03_04_Annulation_Annulinfoannonceanterieur_Reference_Typeavis_Nature_Appeloffre_Qualification,D_10_01_01_02_03_03_05_Annulation_Annulinfoannonceanterieur_Reference_Typeavis_Nature_Appeloffre_Sad,D_10_01_01_02_03_03_06_Annulation_Annulinfoannonceanterieur_Reference_Typeavis_Nature_Appeloffre_Concession,D_10_01_01_02_03_03_07_Annulation_Annulinfoannonceanterieur_Reference_Typeavis_Nature_Appeloffre_Concessionnaire,D_10_01_01_02_03_04_Annulation_Annulinfoannonceanterieur_Reference_Typeavis_Nature_Intentionconclure,D_10_01_01_02_03_05_Annulation_Annulinfoannonceanterieur_Reference_Typeavis_Nature_Attribution,D_10_01_01_02_03_05_01_Annulation_Annulinfoannonceanterieur_Reference_Typeavis_Nature_Attribution_Standard,D_10_01_01_02_03_05_02_Annulation_Annulinfoannonceanterieur_Reference_Typeavis_Nature_Attribution_Concours,D_10_01_01_02_03_05_03_Annulation_Annulinfoannonceanterieur_Reference_Typeavis_Nature_Attribution_Concession,D_10_01_01_02_03_05_04_Annulation_Annulinfoannonceanterieur_Reference_Typeavis_Nature_Attribution_Standardinfructueuxsanssuite,D_10_01_01_02_03_06_Annulation_Annulinfoannonceanterieur_Reference_Typeavis_Nature_Soustraitance,D_10_01_01_02_03_07_Annulation_Annulinfoannonceanterieur_Reference_Typeavis_Nature_Modification,D_10_01_01_02_03_08_Annulation_Annulinfoannonceanterieur_Reference_Typeavis_Nature_Qualification,D_10_01_01_02_03_09_Annulation_Annulinfoannonceanterieur_Reference_Typeavis_Nature_Rectificatif,D_10_01_01_02_03_10_Annulation_Annulinfoannonceanterieur_Reference_Typeavis_Nature_Periodique,D_10_01_01_02_03_11_Annulation_Annulinfoannonceanterieur_Reference_Typeavis_Nature_Autre,D_10_01_01_02_04_Annulation_Annulinfoannonceanterieur_Reference_Typeavis_Statut,D_10_01_01_02_04_01_Annulation_Annulinfoannonceanterieur_Reference_Typeavis_Statut_Initial,D_10_01_01_02_04_02_Annulation_Annulinfoannonceanterieur_Reference_Typeavis_Statut_Rectificatif,D_10_01_01_02_04_03_Annulation_Annulinfoannonceanterieur_Reference_Typeavis_Statut_Annulation,D_10_01_01_02_04_04_Annulation_Annulinfoannonceanterieur_Reference_Typeavis_Statut_Modification,D_10_01_01_03_Annulation_Annulinfoannonceanterieur_Reference_Dateenvoi,D_10_01_02_Annulation_Annulinfoannonceanterieur_Referencepublication,D_10_01_02_01_Annulation_Annulinfoannonceanterieur_Referencepublication_Publicationpapier,D_10_01_02_02_Annulation_Annulinfoannonceanterieur_Referencepublication_Publicationelectronique,D_10_01_02_02_01_Annulation_Annulinfoannonceanterieur_Referencepublication_Publicationelectronique_Datepublication,D_10_01_02_02_02_Annulation_Annulinfoannonceanterieur_Referencepublication_Publicationelectronique_Datefindiffusion,D_10_01_02_03_Annulation_Annulinfoannonceanterieur_Referencepublication_Publicationjoue,D_10_01_02_03_01_Annulation_Annulinfoannonceanterieur_Referencepublication_Publicationjoue_Annee,D_10_01_02_03_02_Annulation_Annulinfoannonceanterieur_Referencepublication_Publicationjoue_Numparution,D_10_01_02_03_03_Annulation_Annulinfoannonceanterieur_Referencepublication_Publicationjoue_Numannonce,D_10_01_02_03_04_Annulation_Annulinfoannonceanterieur_Referencepublication_Publicationjoue_Datepublication,D_10_02_Annulation_Motif
19-33255,CF_NIV_SUIV,CF_NIV_SUIV,19-22100,CF_NIV_SUIV,CF_NIV_SUIV,False,True,False,,,CF_NIV_SUIV,True,,,,False,,,,,,CF_NIV_SUIV,,,CF_NIV_SUIV,,,,,,,,,CF_NIV_SUIV,,,,,,,,,,,CF_NIV_SUIV,True,,,,,CF_NIV_SUIV,[],CF_NIV_SUIV,2019-02-10 23:00:00,2019-02-25 23:00:00,CF_NIV_SUIV,,,,,Infructueux
19-33308,CF_NIV_SUIV,CF_NIV_SUIV,19-18261,CF_NIV_SUIV,CF_NIV_SUIV,False,True,False,,,CF_NIV_SUIV,True,,,,False,,,,,,CF_NIV_SUIV,,,CF_NIV_SUIV,,,,,,,,,CF_NIV_SUIV,,,,,,,,,,,CF_NIV_SUIV,True,,,,,CF_NIV_SUIV,[],CF_NIV_SUIV,2019-02-03 23:00:00,2019-03-06 23:00:00,CF_NIV_SUIV,,,,,La procédure a été classée sans suite pour motif d'intérêt général
19-33491,CF_NIV_SUIV,CF_NIV_SUIV,19-29460,CF_NIV_SUIV,CF_NIV_SUIV,True,False,False,,,CF_NIV_SUIV,True,,,,False,,,,,,CF_NIV_SUIV,,,CF_NIV_SUIV,,,,,,,,,CF_NIV_SUIV,,,,,,,,,,,CF_NIV_SUIV,True,,,,,CF_NIV_SUIV,[],CF_NIV_SUIV,2019-02-21 23:00:00,2019-03-20 23:00:00,CF_NIV_SUIV,,,,,modification du DCE avec l'introduction d'un délai d'exécution des travaux de 6 semaines à compter de la notification et une remise des offres avancée au mercredi 13 mars face à la nécessité d'exécuter les travaux de confortement du bassin au plus vite. Nouvel avis de publicité et nouveau DCE du 26/02/2019
19-33782,CF_NIV_SUIV,CF_NIV_SUIV,19-33739,CF_NIV_SUIV,CF_NIV_SUIV,False,True,False,,,CF_NIV_SUIV,True,,,,False,,,,,,CF_NIV_SUIV,,,CF_NIV_SUIV,,,,,,,,,CF_NIV_SUIV,,,,,,,,,,,CF_NIV_SUIV,True,,,,,CF_NIV_SUIV,[],CF_NIV_SUIV,2019-02-28 23:00:00,2019-03-13 23:00:00,CF_NIV_SUIV,,,,,Le code CPV est erroné
19-33922,CF_NIV_SUIV,CF_NIV_SUIV,19-19577,CF_NIV_SUIV,CF_NIV_SUIV,False,True,False,,,CF_NIV_SUIV,True,,,,False,,,,,,CF_NIV_SUIV,,,CF_NIV_SUIV,,,,,,,,,CF_NIV_SUIV,,,,,,,,,,,CF_NIV_SUIV,True,,,,,CF_NIV_SUIV,[],CF_NIV_SUIV,2019-02-05 23:00:00,2019-03-05 23:00:00,CF_NIV_SUIV,,,,,"Le pouvoir adjudicateur abandonne la procédure adapté en la déclarant sans suite, pour motif d'intérêt général.La décision est motivée par la présence d'erreurs dans les exigences techniques des prestations, rendant impossible le choix de l'offre économiquement la plus avantageuse.Le pouvoir adjudicateur s'engage à lancer une nouvelle procédure pour les mêmes prestations.Instance chargée des procédures de recours : Tribunal administratif de Marseille22,24 rue Breteuil13006 Marseille Tél : 04 91 13 48 13 - Fax : 04 91 81 13 87 greffe.ta-marseille@juradm.fr Organe chargé des procédures de médiation : Tribunal administratif de Marseille22,24 rue Breteuil13006 Marseille Tél : 04 91 13 48 13 - Fax : 04 91 81 13 87 greffe.ta-marseille@juradm.fr"
19-35094,CF_NIV_SUIV,CF_NIV_SUIV,18-118931,CF_NIV_SUIV,CF_NIV_SUIV,False,True,False,,,CF_NIV_SUIV,True,,,,False,,,,,,CF_NIV_SUIV,,,CF_NIV_SUIV,,,,,,,,,CF_NIV_SUIV,,,,,,,,,,,CF_NIV_SUIV,True,,,,,CF_NIV_SUIV,[],CF_NIV_SUIV,2018-08-22 22:00:00,2018-09-28 22:00:00,CF_NIV_SUIV,,,,,"Le présent marché est déclaré sans suite pour un motif d'intérêt général, conformément aux dispositions de l'ordonnance no 2015-899 du 23 juillet 2015 et du décret no 2016-360 du 25 mars 2016. En effet, une redéfinition des besoins s'avère nécessaire et une nouvelle procédure sera relancée ultérieurement."
19-35319,CF_NIV_SUIV,CF_NIV_SUIV,19-34596,CF_NIV_SUIV,CF_NIV_SUIV,False,True,False,,,CF_NIV_SUIV,True,,,,False,,,,,,CF_NIV_SUIV,,,CF_NIV_SUIV,,,,,,,,,CF_NIV_SUIV,,,,,,,,,,,CF_NIV_SUIV,True,,,,,CF_NIV_SUIV,[],CF_NIV_SUIV,2019-03-04 23:00:00,2019-03-12 23:00:00,CF_NIV_SUIV,,,,,"Au vu des différentes prestations demandées, ce marché doit être alloti.Il est donc décidé d'annuler le marché en cours pour le relancer sous la forme de 2 lots."
19-36025,CF_NIV_SUIV,CF_NIV_SUIV,19-34867,CF_NIV_SUIV,CF_NIV_SUIV,False,True,False,,,CF_NIV_SUIV,True,,,,False,,,,,,CF_NIV_SUIV,,,CF_NIV_SUIV,,,,,,,,,CF_NIV_SUIV,,,,,,,,,,,CF_NIV_SUIV,True,,,,,CF_NIV_SUIV,[],CF_NIV_SUIV,2019-03-04 23:00:00,2019-04-01 22:00:00,CF_NIV_SUIV,,,,,"Erreur de publicité. Se reporter à l'annonce No 19-34992 qui fait, également l'objet d'une publication au JOUE."
19-36209,CF_NIV_SUIV,CF_NIV_SUIV,19-35759,CF_NIV_SUIV,CF_NIV_SUIV,True,False,False,,,CF_NIV_SUIV,True,,,,False,,,,,,CF_NIV_SUIV,,,CF_NIV_SUIV,,,,,,,,,CF_NIV_SUIV,,,,,,,,,,,CF_NIV_SUIV,True,,,,,CF_NIV_SUIV,[],CF_NIV_SUIV,2019-03-05 23:00:00,2019-04-05 22:00:00,CF_NIV_SUIV,,,,,manque de lien pour les pièces
19-36530,CF_NIV_SUIV,CF_NIV_SUIV,19-32556,CF_NIV_SUIV,CF_NIV_SUIV,False,True,False,,,CF_NIV_SUIV,True,,,,False,,,,,,CF_NIV_SUIV,,,CF_NIV_SUIV,,,,,,,,,CF_NIV_SUIV,,,,,,,,,,,CF_NIV_SUIV,True,,,,,CF_NIV_SUIV,[],CF_NIV_SUIV,2019-03-05 23:00:00,2019-04-15 22:00:00,CF_NIV_SUIV,,,,,Modification des modalités de publication du marché pour se conformer aux articles 35-I-2 et 36 du décret no2016-360 relatif aux marchés publics.
19-37073,CF_NIV_SUIV,CF_NIV_SUIV,19-36596,CF_NIV_SUIV,CF_NIV_SUIV,False,True,False,,,CF_NIV_SUIV,True,,,,False,,,,,,CF_NIV_SUIV,,,CF_NIV_SUIV,,,,,,,,,CF_NIV_SUIV,,,,,,,,,,,CF_NIV_SUIV,True,,,,,CF_NIV_SUIV,[],CF_NIV_SUIV,2019-03-06 23:00:00,2019-03-24 23:00:00,CF_NIV_SUIV,,,,,Doublon remplacé par avis no 19-36696
19-37185,CF_NIV_SUIV,CF_NIV_SUIV,19-36839,CF_NIV_SUIV,CF_NIV_SUIV,False,True,False,,,CF_NIV_SUIV,True,,,,False,,,,,,CF_NIV_SUIV,,,CF_NIV_SUIV,,,,,,,,,CF_NIV_SUIV,,,,,,,,,,,CF_NIV_SUIV,True,,,,,CF_NIV_SUIV,[],CF_NIV_SUIV,2019-03-07 23:00:00,2019-04-04 22:00:00,CF_NIV_SUIV,,,,,Avis annulé
19-38407,CF_NIV_SUIV,CF_NIV_SUIV,19-37072,CF_NIV_SUIV,CF_NIV_SUIV,False,True,False,,,CF_NIV_SUIV,True,,,,False,,,,,,CF_NIV_SUIV,,,CF_NIV_SUIV,,,,,,,,,CF_NIV_SUIV,,,,,,,,,,,CF_NIV_SUIV,True,,,,,CF_NIV_SUIV,[],CF_NIV_SUIV,2019-03-07 23:00:00,2019-04-07 22:00:00,CF_NIV_SUIV,,,,,"Conformément à l'article 98 du Décret no 2016-360 du 25 mars 2016 relatif aux marchés publics, le Pouvoir Adjudicateur a décidé de ne pas donner suite à cette consultation pour des motifs d'intérêt général (besoin du pouvoir adjudicateur à redéfinir)."
19-38934,CF_NIV_SUIV,CF_NIV_SUIV,19-38176,CF_NIV_SUIV,CF_NIV_SUIV,False,True,False,,,CF_NIV_SUIV,True,,,,False,,,,,,CF_NIV_SUIV,,,CF_NIV_SUIV,,,,,,,,,CF_NIV_SUIV,,,,,,,,,,,CF_NIV_SUIV,True,,,,,CF_NIV_SUIV,[],CF_NIV_SUIV,2019-03-11 23:00:00,2019-05-11 22:00:00,CF_NIV_SUIV,,,,,Numéro de référence du marché qui est visible sur notre plateforme des marchés de l'Etat (PLACE) est incorrect :au lieu de 19UGAP02 LIRE : 19MAR02.Le marché a été relancé avec la bonne référence : 19MAR02.
19-40282,CF_NIV_SUIV,CF_NIV_SUIV,19-39800,CF_NIV_SUIV,CF_NIV_SUIV,False,True,False,,,CF_NIV_SUIV,True,,,,False,,,,,,CF_NIV_SUIV,,,CF_NIV_SUIV,,,,,,,,,CF_NIV_SUIV,,,,,,,,,,,CF_NIV_SUIV,True,,,,,CF_NIV_SUIV,[],CF_NIV_SUIV,2019-03-13 23:00:00,2019-04-14 22:00:00,CF_NIV_SUIV,,,,,Annulation en raison d'une erreur logicielle dans l'élaboration du DCE.
19-41507,CF_NIV_SUIV,CF_NIV_SUIV,19-41061,CF_NIV_SUIV,CF_NIV_SUIV,False,True,False,,,CF_NIV_SUIV,True,,,,False,,,,,,CF_NIV_SUIV,,,CF_NIV_SUIV,,,,,,,,,CF_NIV_SUIV,,,,,,,,,,,CF_NIV_SUIV,True,,,,,CF_NIV_SUIV,[],CF_NIV_SUIV,2019-03-14 23:00:00,2019-04-08 22:00:00,CF_NIV_SUIV,,,,,Suite à une erreur de manipulation l'annonce de ce marché sera publiée dans les jours à venir.
19-41530,CF_NIV_SUIV,CF_NIV_SUIV,19-39722,CF_NIV_SUIV,CF_NIV_SUIV,False,True,False,,,CF_NIV_SUIV,True,,,,False,,,,,,CF_NIV_SUIV,,,CF_NIV_SUIV,,,,,,,,,CF_NIV_SUIV,,,,,,,,,,,CF_NIV_SUIV,True,,,,,CF_NIV_SUIV,[],CF_NIV_SUIV,2019-03-14 23:00:00,2019-04-17 22:00:00,CF_NIV_SUIV,,,,,Erreur du formulaire d'avis de marché
